{"attributes": {"status": " :Category:Status: Alive", "death": "", "last": "", "family": "", "title": "Cotter Pyke", "season": "Season 1", "image": "", "allegiance": "The Night's Watch", "culture": "Ironborn", "titles": " Commander'''Cotter Pyke''' is an unseen character in ''Game of Thrones''. Cotter Pyke is an officer of the Night's Watch, and the commander of Eastwatch.==Biography=====Background===Cotter Pyke is a senior member of the Night's Watch. He serves as commander of Eastwatch, the eastern-most castle on the Wall. He is a bastard, born on the Iron Islands.===Season 1===Lord Commander Jeor Mormont tells Jon Snow that Cotter Pyke's rangers found four wights outside of Eastwatch and wisely burned their corpses.&lt;ref&gt;&quot;Fire and Blood&quot;&lt;/ref&gt;==In the books==In the ''A Song of Ice and Fire'' novels, Cotter Pyke is the bastard son of a tavern wench. He betrays his common origins by being plain, even rough-speaking, with a broken nose. Despite his origins, Cotter Pyke is also considered to be a highly effective and able commander, and stands high in the ranks of the Night's Watch. He holds a level of disdain for, and is essentially the opposite to, Ser Denys Mallister, the commander of The Shadow Tower, who is a highborn knight.==See also==* AWOIAF (MAJOR spoilers from the books)==References==Reflist", "link": "Night's WatchCharacter", "mentioned": "&quot;Fire and Blood&quot;", "place": "Iron Islands", "aka": "", "first": ""}, "sections": {"TOP": "Cotter Pyke0486709iysieh6nz9wss2ze5n1xq5rb2cgei1764492015-03-12T21:15:13ZSon Of Fire24907634Heraldry{{Heraldry\n|image=Crow mini shield.png\n|link=Night's Watch\n}}\n\n{{Character\n| Title=Cotter Pyke\n| Image=\n| Season=[[Season 1|1]]\n| First=\n| Last=\n| Mentioned=&quot;[[Fire and Blood]]&quot;\n| Aka=\n| Status= [[:Category:Status: Alive|Alive]]\n| Death=\n| Place=[[Iron Islands]]\n| Culture=[[Ironborn]]\n| Allegiance=The [[Night's Watch]]\n| Family=\n| Actor=|Titles = Commander}}\n\n'''Cotter Pyke''' is an unseen character in ''[[Game of Thrones]]''. Cotter Pyke is an officer of the [[Night's Watch]], and the commander of [[Eastwatch]].\n\n", "In the books": "In the ''[[A Song of Ice and Fire]]'' novels, Cotter Pyke is the bastard son of a tavern wench. He betrays his common origins by being plain, even rough-speaking, with a broken nose. Despite his origins, Cotter Pyke is also considered to be a highly effective and able commander, and stands high in the ranks of the Night's Watch. He holds a level of disdain for, and is essentially the opposite to, Ser [[Denys Mallister]], the commander of [[The Shadow Tower]], who is a highborn [[knight]].\n\n", "Biography": "===Background===\nCotter Pyke is a senior member of the [[Night's Watch]]. He serves as commander of [[Eastwatch]], the eastern-most castle on [[the Wall]]. He is a [[bastard]], born on the [[Iron Islands]].\n\n===[[Season 1]]===\nLord Commander [[Jeor Mormont]] tells [[Jon Snow]] that Cotter Pyke's rangers found four [[wights]] outside of Eastwatch and wisely burned their corpses.&lt;ref&gt;&quot;[[Fire and Blood]]&quot;&lt;/ref&gt;\n\n", "See also": "* {{AWOIAF}} (MAJOR spoilers from the books)\n\n"}, "title": "Cotter Pyke"}