{"attributes": {"birthplace": " Italy", "title": " Marco Pontecorvo ", "image": " Marco-Pontecorvo-200.jpg", "dateofbirth": " 8 November 1966", "job": " Director of photography", "imdb": " http://www.imdb.com/name/nm0690602/'''Marco Pontecorvo''' (born 8 November 1966) is a cinematographer from Italy. He has worked mostly as the director of photography on Italian projects, but also on some international productions, most notably on ''Rome'', shot in the Cinecitta studios in Rome, Italy, which is apparently when and where his connection to HBO was established.Pontecorvo will be working as director of photography on the first season of ''Game of Thrones''.==See also==*Template:IMDb"}, "sections": {"TOP": "Marco Pontecorvo03931q3zxc1dzw1b3ijf1lac2gaakgza1uzr1484422014-06-24T19:58:43ZIron Bank24961608Adding categories{{Crew\n| Title= Marco Pontecorvo \n| Image= Marco-Pontecorvo-200.jpg\n| dateofbirth= 8 November 1966\n| birthplace= Italy\n| job= Director of photography\n| imdb= http://www.imdb.com/name/nm0690602/\n}}\n'''Marco Pontecorvo''' (born 8 November 1966) is a cinematographer from Italy. He has worked mostly as the director of photography on Italian projects, but also on some international productions, most notably on ''Rome'', shot in the Cinecitta studios in Rome, Italy, which is apparently when and where his connection to HBO was established.\n\nPontecorvo will be working as director of photography on the first season of ''[[Game of Thrones]]''.\n\n"}, "title": "Marco Pontecorvo"}