{"attributes": {"status": " :Category:Status: Alive", "10": "yesreflistCategory:CharactersCategory:Minor CharactersCategory:Season 3 CharactersCategory:Slaves and freedmenCategory:Characters from YunkaiCategory:Status: AliveCategory:House TargaryenCategory:Unnamed CharactersCategory:Characters from Slaver's Bay", "imagesize": " 240px", "title": " Yunkai'i slave", "season": " Season 3", "image": " ", "allegiance": " Daenerys Targaryen", "actor": " Marin Tudor", "culture": " ", "link": " House TargaryenCharacter", "place": " Yunkai", "appearances": " &quot;Mhysa&quot;A '''Yunkai'i slave''' is a minor unnamed character first appearing in Season 3. He's played by Marin Tudor and only appeared in &quot;Mhysa&quot;.==Biography=====Season 3===He is one of the slaves that are freed by Daenerys Targaryen following the Sack of Yunkai. When Daenerys greets the slaves of Yunkai and tells them that it is their own choice to reach for their freedom, the slave stretches his hand towards Daenerys and calls out &quot;mhysa&quot;. After a moment, another follows suit and soon the entire crowd is shouting &quot;mhysa&quot;. When Daenerys steps into the crowd, he is one of the slaves who embraces her.&lt;ref&gt;Mhysa&lt;/ref&gt;==Appearances==Season Three Appearances", "first": " "}, "sections": {"TOP": "Yunkai'i slave 1025071664e460eu96z0he5znskwxt76lkx25v1642012014-11-06T07:51:03ZUltimateSupreme Bot5345390adding Heraldry template{{Heraldry\n|image = Targaryen mini shield.png\n|link = House Targaryen\n}}\n{{Character\n|Title = Yunkai'i slave\n|Season = [[Season 3|3]]\n|First = \n|Status = [[:Category:Status: Alive|Alive]]\n|Place = [[Yunkai]]\n|Allegiance = [[Daenerys Targaryen]]\n|Culture = \n|Actor = [[Marin Tudor]]\n|ImageSize = 240px\n|Image = \n|Appearances = &quot;[[Mhysa]]&quot;}}\nA '''Yunkai'i slave''' is a minor unnamed character first appearing in [[Season 3]]. He's played by [[Marin Tudor]] and only appeared in &quot;[[Mhysa]]&quot;.\n\n", "Biography": "===Season 3===\nHe is one of the slaves that are freed by [[Daenerys Targaryen]] following the Sack of [[Yunkai]]. When Daenerys greets the slaves of Yunkai and tells them that it is their own choice to reach for their freedom, the slave stretches his hand towards Daenerys and calls out &quot;mhysa&quot;. After a moment, another follows suit and soon the entire crowd is shouting &quot;mhysa&quot;. When Daenerys steps into the crowd, he is one of the slaves who embraces her.&lt;ref&gt;[[Mhysa]]&lt;/ref&gt;\n\n"}, "title": "Yunkai'i slave 1"}